{
  "$schema": "https://json-schema.org/draft/2020-12/schema",
  "title": "Formal experiment result row",
  "type": "object",
  "additionalProperties": false,
  "required": [
    "experiment_id", "case_id", "method", "B", "Gamma", "lambda_R",
    "objective", "first_stage_cost", "inventory_cost", "depot_fixed_cost",
    "reconfiguration_cost", "recourse_cost", "RI", "RS", "total_inventory",
    "active_depots", "fr_min_robust", "average_fill_rate_in_worst_service_scenario",
    "worst_region", "worst_scenario", "total_shortage_in_worst_service_scenario",
    "service_penalty_cost", "runtime_seconds", "master_runtime_seconds",
    "subproblem_runtime_seconds", "certification_runtime_seconds", "iterations",
    "cuts", "peak_memory_gb", "optimality_gap", "termination_status",
    "certification_status", "config_hash", "source_data_hash", "data_hash",
    "parameter_hash", "x0_hash", "git_commit",
    "solver_version", "python_version", "random_seed"
  ],
  "properties": {
    "experiment_id": {"type": "string", "enum": ["E1", "E2", "E3", "E4", "E5", "E6", "E7"]},
    "case_id": {"type": "string"},
    "method": {"type": "string"},
    "B": {"type": ["number", "null"]},
    "Gamma": {"type": ["integer", "null"]},
    "lambda_R": {"type": ["number", "null"]},
    "objective": {"type": ["number", "null"]},
    "first_stage_cost": {"type": ["number", "null"]},
    "inventory_cost": {"type": ["number", "null"]},
    "depot_fixed_cost": {"type": ["number", "null"]},
    "reconfiguration_cost": {"type": ["number", "null"]},
    "recourse_cost": {"type": ["number", "null"]},
    "RI": {"type": ["number", "null"]},
    "RS": {"type": ["number", "null"]},
    "total_inventory": {"type": ["number", "null"]},
    "active_depots": {"type": ["integer", "null"]},
    "fr_min_robust": {"type": ["number", "null"]},
    "average_fill_rate_in_worst_service_scenario": {"type": ["number", "null"]},
    "worst_region": {"type": ["string", "null"]},
    "worst_scenario": {"type": ["string", "null"]},
    "total_shortage_in_worst_service_scenario": {"type": ["number", "null"]},
    "service_penalty_cost": {"type": ["number", "null"]},
    "runtime_seconds": {"type": ["number", "null"]},
    "master_runtime_seconds": {"type": ["number", "null"]},
    "subproblem_runtime_seconds": {"type": ["number", "null"]},
    "certification_runtime_seconds": {"type": ["number", "null"]},
    "iterations": {"type": ["integer", "null"]},
    "cuts": {"type": ["integer", "null"]},
    "peak_memory_gb": {"type": ["number", "null"]},
    "optimality_gap": {"type": ["number", "null"]},
    "termination_status": {"type": ["string", "null"]},
    "certification_status": {"type": ["string", "null"]},
    "config_hash": {"type": "string"},
    "source_data_hash": {"type": "string"},
    "data_hash": {"type": "string"},
    "parameter_hash": {"type": "string"},
    "x0_hash": {"type": "string"},
    "git_commit": {"type": "string"},
    "solver_version": {"type": ["string", "null"]},
    "python_version": {"type": "string"},
    "random_seed": {"type": ["integer", "null"]}
  }
}
