{
  "experiment_id": "E2",
  "case_id": "210202",
  "method": "nominal_reconfiguration",
  "B": 84614.30513135393,
  "Gamma": 0,
  "lambda_R": 0.05,
  "objective": 108999.13573275965,
  "first_stage_cost": 84614.3051313539,
  "inventory_cost": 80110.64389502903,
  "depot_fixed_cost": 4503.661236324868,
  "reconfiguration_cost": 0.0,
  "recourse_cost": 24384.83060140576,
  "RI": 3.1575746674186425e-15,
  "RS": 0.0,
  "total_inventory": 5776.468951048715,
  "active_depots": 13,
  "fr_min_robust": 0.7946773732428405,
  "average_fill_rate_in_worst_service_scenario": 0.9828897811035548,
  "worst_region": "12",
  "worst_scenario": "[]",
  "total_shortage_in_worst_service_scenario": 361.60247752321976,
  "service_penalty_cost": null,
  "runtime_seconds": 0.019999980926513672,
  "master_runtime_seconds": null,
  "subproblem_runtime_seconds": null,
  "certification_runtime_seconds": null,
  "iterations": null,
  "cuts": null,
  "peak_memory_gb": null,
  "optimality_gap": 0.0,
  "termination_status": "OPTIMAL",
  "certification_status": "CERTIFIED_EXACT",
  "config_hash": "1dfd422f1dabb099ef389ebabfdbfd51db4571b4366f28664b869d4c85e28b69",
  "source_data_hash": "c27075450bc8ace8e74087316b64f22d2a9a9909cb4e4746341bc9f3998950ea",
  "data_hash": "d40beacd55c43b045db79140e38ee211e904dd72f7d6ca95dfb34c1f5a2cdb35",
  "parameter_hash": "37b5f962c061d29b6b72417007424907b9b1f756a4ad1943a3719048d46b93c0",
  "x0_hash": "188da42a6e1d53ebba6d5c3c5d3af8042da5e9088bacce1a3041252b56cc41d8",
  "git_commit": "1b06be7cc3a6108871d0dc40c6d0da2165b470b7",
  "solver_version": "13.0.1",
  "python_version": "3.12.7",
  "random_seed": 20260907
}
